{
  "schema_version": 2,
  "role": "multipole_design_profile_registry",
  "project_id": "rf_octupole_ion_guide",
  "family_id": "rf_multipole_ion_optics",
  "profiles": [
    {
      "design_profile_id": "baseline_finite_3d",
      "design_request": "config/requests/baseline.json",
      "design_variables": "config/design_variables.json",
      "optimization_envelope": "config/optimization_envelope.json",
      "sha256": {
        "design_request": "177112FB257E1D185F7A38AB67A862BA358DBCD9BBD60351FAEED6917FCED2C6",
        "design_variables": "F1E4F1D4A4DAEBC6D8D69983E36744FDB92294A5956530094BAC0E66085F257F",
        "optimization_envelope": "32CE84454B45C44E44CAA5BAAB809D5F0695200F14308503A46C1A6247EC49C4"
      },
      "identity": {
        "project_id": "rf_octupole_ion_guide",
        "family_id": "rf_multipole_ion_optics",
        "radial_order_n": 4,
        "electrode_count": 8
      },
      "topology": {
        "enclosure_role": "full_length_grounded_shield",
        "segmentation_strategy": "uniform",
        "axial_drive_topology": "segmented_rod_axial_acceleration"
      }
    },
    {
      "design_profile_id": "exit_aperture_plate_acceleration_reference",
      "design_request": "config/requests/exit_aperture_plate.json",
      "design_variables": "config/design_variables_exit_aperture_plate.json",
      "optimization_envelope": "config/optimization_envelope_exit_aperture_plate.json",
      "sha256": {
        "design_request": "6107ABC203022AE7B72904475D72491489D9408A0D6D8E939106D2678FCD2851",
        "design_variables": "75CC1E4501EFF6AF1D5DBF906DDE0BC8483FA9E5B204C20D23AEC30DB3FA0281",
        "optimization_envelope": "D6E9CD5A49C619B157675352685CCAF893FA3A831B7AF5F29E48D5F4E1089481"
      },
      "identity": {
        "project_id": "rf_octupole_ion_guide",
        "family_id": "rf_multipole_ion_optics",
        "radial_order_n": 4,
        "electrode_count": 8
      },
      "topology": {
        "enclosure_role": "full_length_grounded_shield",
        "segmentation_strategy": "off",
        "axial_drive_topology": "exit_aperture_plate_potential_step"
      }
    },
    {
      "design_profile_id": "no_acceleration_full_length",
      "design_request": "config/requests/no_acceleration_full_length.json",
      "design_variables": "config/design_variables_no_acceleration.json",
      "optimization_envelope": "config/optimization_envelope_no_acceleration.json",
      "sha256": {
        "design_request": "7C92E86453DFC3ABA7BFF0F822BE78E447842D2D51B21430EC0C2370FCF7E9D9",
        "design_variables": "07EE7078B6AFCAA4D74D9FD42E17E52213DD92DCF3CEA6980FB3745F11168869",
        "optimization_envelope": "E3DF2FA6EA45FF256C4B7CD54B51D5DB536BC075D6D762C53788B0D4C229584B"
      },
      "identity": {
        "project_id": "rf_octupole_ion_guide",
        "family_id": "rf_multipole_ion_optics",
        "radial_order_n": 4,
        "electrode_count": 8
      },
      "topology": {
        "enclosure_role": "full_length_grounded_shield",
        "segmentation_strategy": "off",
        "axial_drive_topology": "none"
      }
    }
  ]
}
